{
  "contract_version": 2,
  "profile": "v3-beta",
  "device_id": "iot-md-001",
  "release": {"version": "3.0.0-alpha.20", "sequence": 2725, "confirmed": true},
  "started_at": 1799078400,
  "observed_at": 1799251200,
  "elapsed_s": 172800,
  "counters": {
    "samples": 2881,
    "health_samples": 2878,
    "storage_samples": 2878,
    "unhealthy_samples": 0,
    "consecutive_unhealthy": 0,
    "maximum_consecutive_unhealthy": 0,
    "network_interruptions": 3,
    "network_recoveries": 3,
    "renewal_attempts": 1,
    "renewal_successes": 1,
    "renewal_failures": 0,
    "update_trials": 3,
    "update_confirmations": 3,
    "update_failures": 0,
    "update_rollbacks": 0,
    "power_interruptions": 3,
    "power_recoveries": 3,
    "power_failures": 0,
    "native_recoveries_attempts": 3,
    "native_recoveries_successes": 3,
    "native_recoveries_failures": 0,
    "watchdog_recoveries_attempts": 3,
    "watchdog_recoveries_successes": 3,
    "watchdog_recoveries_failures": 0,
    "identity_transactions_attempts": 1,
    "identity_transactions_successes": 1,
    "identity_transactions_failures": 0,
    "fleet_transactions_attempts": 1,
    "fleet_transactions_successes": 1,
    "fleet_transactions_failures": 0,
    "migration_rollbacks_attempts": 1,
    "migration_rollbacks_successes": 1,
    "migration_rollbacks_failures": 0,
    "driver_checks_attempts": 13,
    "driver_checks_successes": 13,
    "driver_checks_failures": 0
  },
  "measurements": {
    "minimum_storage_free_bytes": 524288,
    "maximum_network_recovery_s": 18,
    "network_outage_open": false
  },
  "gates": [
    {"name": "soak", "status": "passed", "observed": 172800, "required": 172800},
    {"name": "health", "status": "passed", "observed": 2878, "required": 2400},
    {"name": "storage", "status": "passed", "observed": 2878, "required": 2400},
    {"name": "network-recovery", "status": "passed", "observed": 3, "required": 3},
    {"name": "certificate-renewal", "status": "passed", "observed": 1, "required": 1},
    {"name": "paired-updates", "status": "passed", "observed": 3, "required": 3},
    {"name": "power-recovery", "status": "passed", "observed": 3, "required": 3},
    {"name": "canary-health", "status": "passed", "observed": 3, "required": 1},
    {"name": "release-confirmation", "status": "passed", "observed": 1, "required": 1},
    {"name": "native-recovery", "status": "passed", "observed": 3, "required": 3},
    {"name": "watchdog-recovery", "status": "passed", "observed": 3, "required": 3},
    {"name": "identity-interoperability", "status": "passed", "observed": 1, "required": 1},
    {"name": "fleet-interoperability", "status": "passed", "observed": 1, "required": 1},
    {"name": "driver-hardware", "status": "passed", "observed": 13, "required": 13}
  ],
  "promotion_ready": true
}
